[{"campus_id":"cam_im3_campus_01317915930","canonical_name":"Centersquare IAD4-B","county_name":"Loudoun County","created_at":"2026-09-01T00:30:00Z","evidence_status":"sufficient","facility_id":"fac_im3_building_00300163074","operator_canonical_name":"Centersquare","operator_id":"opr_im3_fe5f655baedee65e7f2c","primary_county_fips":"51107","priority_score":100.0,"priority_tier":"pilot_high","record_status":"active","review_status":"verified","schema_version":"1.0.0","selection_reasons":["Selected from a top-8 county by active canonical facility count.","Source supplies a facility name suitable for evidence search.","A source-backed normalized operator relationship is available.","Mapped building footprint supports parcel and permit lookup.","Campus membership supports project and phase history research."],"source_layer":"building","state_abbr":"VA","suggested_source_types":["operator_release","planning_record","zoning_record","permit_record","assessor_record","utility_filing","regulatory_filing","sec_filing","local_news","trade_press"],"target_attributes":["facility.current_status","facility.facility_type","event.announced","event.construction_started","event.operational","event.expansion_operational","event.closed","operator_relationship.roles","observation.capacity_mw","observation.floor_area_sqft"],"updated_at":"2026-09-01T01:00:00Z","verification_candidate_id":"lvc_im3_b76219fb8ae194b36166"},{"campus_id":"cam_im3_campus_01020953461","canonical_name":"Digital Realty Northern Virginia IAD14","county_name":"Loudoun County","created_at":"2026-09-01T00:30:00Z","evidence_status":"no_external_evidence","facility_id":"fac_im3_building_00300969614","operator_canonical_name":"Digital Realty","operator_id":"opr_im3_4f747d90685b8d44661a","primary_county_fips":"51107","priority_score":100.0,"priority_tier":"pilot_high","record_status":"active","review_status":"queued","schema_version":"1.0.0","selection_reasons":["Selected from a top-8 county by active canonical facility count.","Source supplies a facility name suitable for evidence search.","A source-backed normalized operator relationship is available.","Mapped building footprint supports parcel and permit lookup.","Campus membership supports project and phase history research."],"source_layer":"building","state_abbr":"VA","suggested_source_types":["operator_release","planning_record","zoning_record","permit_record","assessor_record","utility_filing","regulatory_filing","sec_filing","local_news","trade_press"],"target_attributes":["facility.current_status","facility.facility_type","event.announced","event.construction_started","event.operational","event.expansion_operational","event.closed","operator_relationship.roles","observation.capacity_mw","observation.floor_area_sqft"],"updated_at":"2026-09-01T00:30:00Z","verification_candidate_id":"lvc_im3_4f270efeef5fd794b292"},{"campus_id":"cam_im3_campus_01020953461","canonical_name":"Amazon Web Services Building C","county_name":"Loudoun County","created_at":"2026-09-01T00:30:00Z","evidence_status":"no_external_evidence","facility_id":"fac_im3_building_00300969615","operator_canonical_name":"Amazon Web Services","operator_id":"opr_im3_e286778b9c16222b1a78","primary_county_fips":"51107","priority_score":100.0,"priority_tier":"pilot_high","record_status":"active","review_status":"queued","schema_version":"1.0.0","selection_reasons":["Selected from a top-8 county by active canonical facility count.","Source supplies a facility name suitable for evidence search.","A source-backed normalized operator relationship is available.","Mapped building footprint supports parcel and permit lookup.","Campus membership supports project and phase history research."],"source_layer":"building","state_abbr":"VA","suggested_source_types":["operator_release","planning_record","zoning_record","permit_record","assessor_record","utility_filing","regulatory_filing","sec_filing","local_news","trade_press"],"target_attributes":["facility.current_status","facility.facility_type","event.announced","event.construction_started","event.operational","event.expansion_operational","event.closed","operator_relationship.roles","observation.capacity_mw","observation.floor_area_sqft"],"updated_at":"2026-09-01T00:30:00Z","verification_candidate_id":"lvc_im3_985b78b666a2aeec60d6"},{"campus_id":"cam_im3_campus_01344376232","canonical_name":"NTT Silicon Valley SV1 Data Center","county_name":"Santa Clara County","created_at":"2026-09-01T00:30:00Z","evidence_status":"sufficient","facility_id":"fac_im3_building_00888253616","operator_canonical_name":"NTT","operator_id":"opr_im3_d4cc2e3bab6ba157a096","primary_county_fips":"06085","priority_score":75.42,"priority_tier":"pilot_high","record_status":"active","review_status":"verified","schema_version":"1.0.0","selection_reasons":["Selected from a top-8 county by active canonical facility count.","Source supplies a facility name suitable for evidence search.","A source-backed normalized operator relationship is available.","Mapped building footprint supports parcel and permit lookup.","Campus membership supports project and phase history research."],"source_layer":"building","state_abbr":"CA","suggested_source_types":["operator_release","planning_record","zoning_record","permit_record","assessor_record","utility_filing","regulatory_filing","sec_filing","local_news","trade_press"],"target_attributes":["facility.current_status","facility.facility_type","event.announced","event.construction_started","event.operational","event.expansion_operational","event.closed","operator_relationship.roles","observation.capacity_mw","observation.floor_area_sqft"],"updated_at":"2026-09-01T01:00:00Z","verification_candidate_id":"lvc_im3_c556437093508d2f96ad"},{"campus_id":"cam_im3_campus_00696992451","canonical_name":"Amazon IAD14","county_name":"Prince William County","created_at":"2026-09-01T00:30:00Z","evidence_status":"conflicting","facility_id":"fac_im3_building_00460059465","operator_canonical_name":"Amazon Web Services","operator_id":"opr_im3_e286778b9c16222b1a78","primary_county_fips":"51153","priority_score":71.67,"priority_tier":"pilot_high","record_status":"active","review_status":"needs_review","schema_version":"1.0.0","selection_reasons":["Selected from a top-8 county by active canonical facility count.","Source supplies a facility name suitable for evidence search.","A source-backed normalized operator relationship is available.","Mapped building footprint supports parcel and permit lookup.","Campus membership supports project and phase history research."],"source_layer":"building","state_abbr":"VA","suggested_source_types":["operator_release","planning_record","zoning_record","permit_record","assessor_record","utility_filing","regulatory_filing","sec_filing","local_news","trade_press"],"target_attributes":["facility.current_status","facility.facility_type","event.announced","event.construction_started","event.operational","event.expansion_operational","event.closed","operator_relationship.roles","observation.capacity_mw","observation.floor_area_sqft"],"updated_at":"2026-09-01T01:00:00Z","verification_candidate_id":"lvc_im3_0c4cc0c5a20ff47edd30"},{"campus_id":"cam_im3_campus_00696992451","canonical_name":"Amazon IAD59","county_name":"Prince William County","created_at":"2026-09-01T00:30:00Z","evidence_status":"no_external_evidence","facility_id":"fac_im3_building_00460060340","operator_canonical_name":"Amazon Web Services","operator_id":"opr_im3_e286778b9c16222b1a78","primary_county_fips":"51153","priority_score":71.67,"priority_tier":"pilot_high","record_status":"active","review_status":"queued","schema_version":"1.0.0","selection_reasons":["Selected from a top-8 county by active canonical facility count.","Source supplies a facility name suitable for evidence search.","A source-backed normalized operator relationship is available.","Mapped building footprint supports parcel and permit lookup.","Campus membership supports project and phase history research."],"source_layer":"building","state_abbr":"VA","suggested_source_types":["operator_release","planning_record","zoning_record","permit_record","assessor_record","utility_filing","regulatory_filing","sec_filing","local_news","trade_press"],"target_attributes":["facility.current_status","facility.facility_type","event.announced","event.construction_started","event.operational","event.expansion_operational","event.closed","operator_relationship.roles","observation.capacity_mw","observation.floor_area_sqft"],"updated_at":"2026-09-01T00:30:00Z","verification_candidate_id":"lvc_im3_bf4b1b13555102a99953"},{"campus_id":"cam_im3_campus_00696992451","canonical_name":"Amazon IAD52","county_name":"Prince William County","created_at":"2026-09-01T00:30:00Z","evidence_status":"no_external_evidence","facility_id":"fac_im3_building_00460060341","operator_canonical_name":"Amazon Web Services","operator_id":"opr_im3_e286778b9c16222b1a78","primary_county_fips":"51153","priority_score":71.67,"priority_tier":"pilot_high","record_status":"active","review_status":"queued","schema_version":"1.0.0","selection_reasons":["Selected from a top-8 county by active canonical facility count.","Source supplies a facility name suitable for evidence search.","A source-backed normalized operator relationship is available.","Mapped building footprint supports parcel and permit lookup.","Campus membership supports project and phase history research."],"source_layer":"building","state_abbr":"VA","suggested_source_types":["operator_release","planning_record","zoning_record","permit_record","assessor_record","utility_filing","regulatory_filing","sec_filing","local_news","trade_press"],"target_attributes":["facility.current_status","facility.facility_type","event.announced","event.construction_started","event.operational","event.expansion_operational","event.closed","operator_relationship.roles","observation.capacity_mw","observation.floor_area_sqft"],"updated_at":"2026-09-01T00:30:00Z","verification_candidate_id":"lvc_